{
  "name": "Cura",
  "tagline": "Business Decision Intelligence Platform",
  "companyName": "Cura Software",
  "companyUrl": "https://curasoftware.com",
  "supportEmail": "support@curasoftware.com",
  "supportUrl": "https://curasoftware.com",
  "copyrightHolder": "Cura",
  "description": "Enterprise Workflow Engine having end to end Analytics and Predicitive Analytics capabilities",
  "colors": {
    "primary": "#4f7bff",
    "secondary": "#764ba2"
  },
  "features": {
    "showLandingPage": true,
    "showPublicRegistration": true
  },
  "legal": {
    "privacyEmail": "support@curasoftware.com",
    "legalEmail": "support@curasoftware.com",
    "dpoEmail": "support@curasoftware.com"
  },
  "emails": {
    "fromName": "Cura Analytics Platform",
    "fromAddress": "support@curasoftware.com"
  },
  "docker": {
    "prefix": "pravaha",
    "registry": "analytics"
  },
  "documentation": {
    "docsUrl": "https://docs.curasoftware.ai",
    "runbookUrl": "https://docs.curasoftware.ai/runbooks"
  },
  "system": {
    "systemEmail": "support@curasoftware.com",
    "metricsPrefix": "pravaha",
    "jwtIssuer": "pravaha-backend",
    "jwtAudience": "pravaha-api"
  }
}
